{
  "bab": 17,
  "judul": {
    "sanskrit": "Śraddhā-traya-vibhāga-yoga",
    "id": "Śraddhā Traya Vibhāga Yoga",
    "ban": "Ida Sang Prabu Traya Vibhaga Yoga",
    "en": "Śraddhā Traya Vibhāga Yoga"
  },
  "jumlah_sloka": 28,
  "sumber": {
    "sanskrit": "Vedic Scriptures Bhagavad Gita API — Bab 17",
    "terjemahan_id": "Draf terjemahan mesin dari teks rujukan berbahasa Inggris; wajib telaah ahli sebelum publikasi.",
    "terjemahan_ban": "Draf terjemahan mesin dari teks Indonesia proyek; wajib telaah penutur Bali sebelum publikasi.",
    "terjemahan_en": "Machine-translation draft from the project Indonesian text; expert review required before publication."
  },
  "sloka": [
    {
      "no": 1,
      "devanagari": "अर्जुन उवाच । ये शास्त्रविधिमुत्सृज्य यजन्ते श्रद्धयान्विताः । तेषां निष्ठा तु का कृष्ण सत्त्वमाहो रजस्तमः ॥ १७.१ ॥",
      "iast": "arjuna uvāca | ye śāstravidhimutsṛjya yajante śraddhayānvitāḥ | teṣāṃ niṣṭhā tu kā kṛṣṇa sattvamāho rajastamaḥ || 17.1 ||",
      "id": "17.1 Arjuna berkata Mereka yang mengesampingkan tata cara kitab suci, melakukan pengorbanan dengan keyakinan, bagaimana kondisinya, wahai Krishna? Apakah Sattva, Rajas atau Tamas?",
      "ban": "17.1 Sang Arjuna ngandika Sang sane nyisipang pidabdab-pidabdab kitab suci, ngamargiang yadnya antuk kapercayaan, napike kahanannyane, duh Sang Kresna? Napi sane kabaos Satwa, Raja utawi Tamas?",
      "status": {
        "id": "draf",
        "ban": "draf",
        "en": "draf"
      },
      "catatan": "",
      "en": "17.1 Arjuna said Those who set aside scriptural ordinances, perform sacrifices with faith, what is their condition, O Krishna? What is Sattva, Rajas or Tamas?"
    },
    {
      "no": 2,
      "devanagari": "श्रीभगवानुवाच । त्रिविधा भवति श्रद्धा देहिनां सा स्वभावजा । सात्त्विकी राजसी चैव तामसी चेति तां शृणु ॥ १७.२ ॥",
      "iast": "śrībhagavānuvāca | trividhā bhavati śraddhā dehināṃ sā svabhāvajā | sāttvikī rājasī caiva tāmasī ceti tāṃ śṛṇu || 17.2 ||",
      "id": "17.2 Bhagavā bersabda Tiga tingkat adalah keyakinan dari yang berwujud, yang melekat dalam sifat mereka yaitu Sattvic (murni), Rajasic (bersemangat) dan Tamasic (gelap). Apakah kamu mendengarnya?",
      "ban": "17.2 Ida Sang Hyang Widhi Wasa ngandika Tigang undagan punika wantah kapercayaan wangun-wangun, sane melekat ring sifatnyane inggih punika Sattvic (murni), Rajasic (berpihak) lan Tamasic (gelap). Napike semeton sampun miragi indike punika?",
      "status": {
        "id": "draf",
        "ban": "draf",
        "en": "draf"
      },
      "catatan": "",
      "en": "17.2 The Blessed One said The three levels are the beliefs of the forms, which are inherent in their nature namely Sattvic (pure), Rajasic (ardent) and Tamasic (dark). Did you hear that?"
    },
    {
      "no": 3,
      "devanagari": "सत्त्वानुरूपा सर्वस्य श्रद्धा भवति भारत । श्रद्धामयोऽयं पुरुषो यो यच्छ्रद्धः स एव सः ॥ १७.३ ॥",
      "iast": "sattvānurūpā sarvasya śraddhā bhavati bhārata | śraddhāmayo|ayaṃ puruṣo yo yacchraddhaḥ sa eva saḥ || 17.3 ||",
      "id": "17.3 Keimanan setiap orang sesuai dengan fitrahnya, wahai Arjuna. Manusia terdiri dari imannya; sebagaimana iman seseorang, demikian pula dia.",
      "ban": "17.3 Kapracayan asing-asing jadma punika manut ring kawentenan ipun, duh Sang Arjuna. Manusa kawangun antuk kapracayannyane; sakadi kapercayaan jadmane, kadi asapunika taler ipun.",
      "status": {
        "id": "draf",
        "ban": "draf",
        "en": "draf"
      },
      "catatan": "",
      "en": "17.3 Every person's faith is in accordance with his nature, O Arjuna. Man consists of his faith; as a person's faith is, so is he."
    },
    {
      "no": 4,
      "devanagari": "यजन्ते सात्त्विका देवान्यक्षरक्षांसि राजसाः । प्रेतान्भूतगणांश्चान्ये यजन्ते तामसा जनाः ॥ १७.४ ॥",
      "iast": "yajante sāttvikā devānyakṣarakṣāṃsi rājasāḥ | pretānbhūtagaṇāṃścānye yajante tāmasā janāḥ || 17.4 ||",
      "id": "17.4 Sattvic atau manusia suci menyembah para dewa; Rajasic atau pemujaan yang penuh gairah terhadap Yaksha dan Rakshasa; yang lain (orang Tamasic atau orang-orang yang tertipu) memuja hantu dan roh alam.",
      "ban": "17.4 Sattvic utawi anak lanang sane suci ngaturang sembah ring para dewata; Rajasik utawi pamujaan sane semangat ring Yaksa lan Raksasa; sane lianan (jadma Tamasic utawi jadma sane tertipu) ngaturang sembah ring beburon lan roh alam.",
      "status": {
        "id": "draf",
        "ban": "draf",
        "en": "draf"
      },
      "catatan": "",
      "en": "17.4 Sattvic or holy men worship the gods; Rajasic or passionate worship of Yakshas and Rakshasas; others (Tamasic people or deluded people) worship ghosts and nature spirits."
    },
    {
      "no": 5,
      "devanagari": "अशास्त्रविहितं घोरं तप्यन्ते ये तपो जनाः । दम्भाहंकारसंयुक्ताः कामरागबलान्विताः ॥ १७.५ ॥",
      "iast": "aśāstravihitaṃ ghoraṃ tapyante ye tapo janāḥ | dambhāhaṃkārasaṃyuktāḥ kāmarāgabalānvitāḥ || 17.5 ||",
      "id": "17.5 Orang-orang yang mempraktikkan pertapaan hebat yang tidak diperintahkan oleh kitab suci, cenderung bersikap munafik dan egois, didorong oleh kekuatan nafsu dan kemelekatan.",
      "ban": "17.5 Sang sane ngamargiang tapa sane mautama nenten kapituduhang antuk kitab suci, cenderung munafik lan egois, kasokong olih kekuatan nafsu lan keterkaitan.",
      "status": {
        "id": "draf",
        "ban": "draf",
        "en": "draf"
      },
      "catatan": "",
      "en": "17.5 Those who practice great austerities not commanded by the scriptures, tend to be hypocritical and selfish, driven by the forces of lust and attachment."
    },
    {
      "no": 6,
      "devanagari": "कर्षयन्तः शरीरस्थं भूतग्राममचेतसः । मां चैवान्तःशरीरस्थं तान्विद्ध्यासुरनिश्चयान् ॥ १७.६ ॥",
      "iast": "karṣayantaḥ śarīrasthaṃ bhūtagrāmamacetasaḥ | māṃ caivāntaḥśarīrasthaṃ tānviddhyāsuraniścayān || 17.6 ||",
      "id": "17.6 Tidak masuk akal, menyiksa semua unsur di dalam tubuh dan Aku juga, Yang berdiam di dalam tubuh, mengetahui bahwa engkau semua ini berasal dari ketetapan setan.",
      "ban": "17.6 Tan masuk akal, nyiksa sakancan unsur-unsur ring angga tur titiang taler, Sane magenah ring angga, uning mungguing semeton sami puniki mawit saking pakarsan Setan.",
      "status": {
        "id": "draf",
        "ban": "draf",
        "en": "draf"
      },
      "catatan": "",
      "en": "17.6 Unreasonable, torturing all the elements in the body and I too, Who dwell in the body, know that you all this comes from the decree of Satan."
    },
    {
      "no": 7,
      "devanagari": "आहारस्त्वपि सर्वस्य त्रिविधो भवति प्रियः । यज्ञस्तपस्तथा दानं तेषां भेदमिमं शृणु ॥ १७.७ ॥",
      "iast": "āhārastvapi sarvasya trividho bhavati priyaḥ | yajñastapastathā dānaṃ teṣāṃ bhedamimaṃ śṛṇu || 17.7 ||",
      "id": "17.7 Makanan yang disayangi setiap orang ada tiga jenisnya, begitu pula pengorbanan, pertapaan, dan sedekah. Dengarkanlah perbedaannya.",
      "ban": "17.7 Ajengan sane kasenengin olih sakancan jadma wenten tigang soroh, minakadi yadnya, tepat miwah sedekah. Pirenginja pabinayannyane.",
      "status": {
        "id": "draf",
        "ban": "draf",
        "en": "draf"
      },
      "catatan": "",
      "en": "17.7 The food that everyone loves is of three kinds, as are sacrifice, austerity and almsgiving. Listen to the difference."
    },
    {
      "no": 8,
      "devanagari": "आयुःसत्त्वबलारोग्यसुखप्रीतिविवर्धनाः । रस्याः स्निग्धाः स्थिरा हृद्या आहाराः सात्त्विकप्रियाः ॥ १७.८ ॥",
      "iast": "āyuḥsattvabalārogyasukhaprītivivardhanāḥ | rasyāḥ snigdhāḥ sthirā hṛdyā āhārāḥ sāttvikapriyāḥ || 17.8 ||",
      "id": "17.8 Makanan yang meningkatkan kehidupan, kemurnian, kekuatan, kesehatan, kegembiraan dan keceriaan (nafsu makan yang baik), yang gurih dan berminyak, banyak dan menyenangkan, disukai oleh orang-orang Sattvic (murni).",
      "ban": "17.8 Ajengan sane ngajegang kauripan, kasucian, kekuatan, kesehatan, sukacita lan girang (nafsu makan sane becik), sane gurih lan berminyak, akeh lan nyenengin, punika kasenengin olih jadma Sattvic (murni).",
      "status": {
        "id": "draf",
        "ban": "draf",
        "en": "draf"
      },
      "catatan": "",
      "en": "17.8 Food that promotes life, purity, strength, health, joy and cheerfulness (good appetite), which is savory and oily, plentiful and pleasant, is loved by Sattvic (pure) people."
    },
    {
      "no": 9,
      "devanagari": "कट्वम्ललवणात्युष्णतीक्ष्णरूक्षविदाहिनः । आहारा राजसस्येष्टा दुःखशोकामयप्रदाः ॥ १७.९ ॥",
      "iast": "kaṭvamlalavaṇātyuṣṇatīkṣṇarūkṣavidāhinaḥ | āhārā rājasasyeṣṭā duḥkhaśokāmayapradāḥ || 17.9 ||",
      "id": "17.9 Makanan yang pahit, asam, asin, terlalu panas, pedas, kering dan terbakar, disukai oleh Rajas dan menghasilkan kesakitan, kesedihan dan penyakit.",
      "ban": "17.9 Ajengan sane pait, asem, asin, kaliwat panes, pedas, tuh tur ngendih, punika kasenengin olih Raja tur ngawetuang sakit, sedih miwah gering.",
      "status": {
        "id": "draf",
        "ban": "draf",
        "en": "draf"
      },
      "catatan": "",
      "en": "17.9 Food that is bitter, sour, salty, too hot, spicy, dry and burning, is loved by Rajas and produces pain, sorrow and disease."
    },
    {
      "no": 10,
      "devanagari": "यातयामं गतरसं पूति पर्युषितं च यत् । उच्छिष्टमपि चामेध्यं भोजनं तामसप्रियम् ॥ १७.१० ॥",
      "iast": "yātayāmaṃ gatarasaṃ pūti paryuṣitaṃ ca yat | ucchiṣṭamapi cāmedhyaṃ bhojanaṃ tāmasapriyam || 17.10 ||",
      "id": "17.10 Makanan yang tidak enak, tidak berasa, busuk, busuk, sampah dan tidak murni, adalah makanan yang disukai oleh orang Tamasic.",
      "ban": "17.10 Ajengan sane nenten becik, tan rasa, busuk, busuk, sampah lan leteh, inggih punika ajengan sane kasenengin olih krama Tamasic.",
      "status": {
        "id": "draf",
        "ban": "draf",
        "en": "draf"
      },
      "catatan": "",
      "en": "17.10 Food that is unpalatable, tasteless, rotten, putrid, rubbish and impure, is the food preferred by the Tamasic people."
    },